{
  "$schema": "https://json-schema.org/draft/2020-12/schema",
  "$id": "https://github.com/ai-furniture-estimator/stage-7/project-input.schema.json",
  "title": "Project Input Schema",
  "description": "Versioned canonical output contract for the OpenRouter kitchen parser. One version per schema change. Used as the structured output contract and the final local validation gate.",
  "type": "object",
  "properties": {
    "schema_version": {
      "type": "string",
      "enum": ["project-input-v2"],
      "description": "Canonical schema version specifier."
    },
    "project_type": {
      "type": "string",
      "enum": ["KITCHEN"],
      "description": "MVP project category. Stage 7 accepts kitchen projects only."
    },
    "project": {
      "type": "object",
      "description": "Project-wide metadata.",
      "properties": {
        "name": {
          "$ref": "#/$defs/TextFact",
          "description": "User-provided project name or description label."
        },
        "notes": {
          "$ref": "#/$defs/TextFact",
          "description": "Additional user notes."
        }
      },
      "additionalProperties": false
    },
    "client": {
      "type": "object",
      "description": "Client or object context information.",
      "properties": {
        "name": {
          "$ref": "#/$defs/TextFact",
          "description": "Client name."
        },
        "address": {
          "$ref": "#/$defs/TextFact",
          "description": "Installation address."
        },
        "phone": {
          "$ref": "#/$defs/TextFact",
          "description": "Contact phone."
        }
      },
      "additionalProperties": false
    },
    "layout": {
      "type": "object",
      "description": "Requested kitchen geometry and dimensions.",
      "properties": {
        "run_shape": {
          "$ref": "#/$defs/LayoutShapeFact",
          "description": "Shape explicitly requested or described by the user; the parser does not design a layout."
        },
        "run_length_mm": {
          "$ref": "#/$defs/IntegerFact",
          "description": "Total available length for the run in millimetres."
        },
        "zone": {
          "$ref": "#/$defs/ZoneFact",
          "description": "Which user-described zone the geometry applies to."
        },
        "wall_height_mm": {
          "$ref": "#/$defs/IntegerFact",
          "description": "Room height constraint."
        }
      },
      "additionalProperties": false
    },
    "modules": {
      "type": "object",
      "description": "Required modules, appliances, and their constraints.",
      "properties": {
        "required_modules": {
          "type": "array",
          "description": "Explicitly requested layout furniture modules or appliance slots. Non-layout surfaces such as countertops are excluded.",
          "items": {
            "$ref": "#/$defs/RequiredLayoutEntity"
          }
        },
        "forbidden_roles": {
          "type": "array",
          "description": "Module roles or types explicitly excluded.",
          "items": {
            "$ref": "#/$defs/TextFact"
          }
        },
        "preferred_module_order": {
          "type": "array",
          "description": "User-stated preferred order of modules.",
          "items": {
            "$ref": "#/$defs/TextFact"
          }
        }
      },
      "additionalProperties": false
    },
    "materials": {
      "type": "object",
      "description": "Material and finish preferences.",
      "properties": {
        "countertop_material": {
          "$ref": "#/$defs/TextFact",
          "description": "Countertop/tabletop material."
        },
        "facade_material": {
          "$ref": "#/$defs/TextFact",
          "description": "Facade/doors material."
        },
        "facade_color": {
          "$ref": "#/$defs/TextFact",
          "description": "Facade colour or finish."
        },
        "body_material": {
          "$ref": "#/$defs/TextFact",
          "description": "Body/carcass material."
        },
        "edge_material": {
          "$ref": "#/$defs/TextFact",
          "description": "Edge-banding material."
        },
        "hardware_preferences": {
          "type": "array",
          "description": "Preferred hardware brands or types.",
          "items": {
            "$ref": "#/$defs/TextFact"
          }
        }
      },
      "additionalProperties": false
    },
    "constraints": {
      "type": "object",
      "description": "Budget, timeline, and other project constraints.",
      "properties": {
        "budget_rub": {
          "$ref": "#/$defs/IntegerFact",
          "description": "Overall budget in RUB."
        },
        "budget_notes": {
          "$ref": "#/$defs/TextFact",
          "description": "Budget-related context."
        },
        "deadline": {
          "$ref": "#/$defs/TextFact",
          "description": "Expected completion or delivery date."
        },
        "special_requirements": {
          "type": "array",
          "description": "Other special requirements or constraints.",
          "items": {
            "$ref": "#/$defs/TextFact"
          }
        }
      },
      "additionalProperties": false
    },
    "missing_questions": {
      "type": "array",
      "description": "Meaningful questions about insufficient data, returned by the parser.",
      "items": {
        "$ref": "#/$defs/MissingQuestion"
      }
    },
    "evidence": {
      "type": "array",
      "description": "Aggregated source evidence summary for extracted facts.",
      "items": {
        "$ref": "#/$defs/EvidenceItem"
      }
    },
    "parser_metadata": {
      "$ref": "#/$defs/ParserMetadata"
    }
  },
  "required": ["schema_version", "project_type", "missing_questions", "evidence", "parser_metadata"],
  "additionalProperties": false,
  "$defs": {
    "FactState": {
      "type": "string",
      "enum": ["KNOWN", "INFERRED", "UNKNOWN", "CONFLICT", "NOT_APPLICABLE"],
      "description": "Certainty level of a parsed fact. KNOWN = explicitly stated; INFERRED = limited evidence-based deduction; UNKNOWN = no data; CONFLICT = contradictory sources; NOT_APPLICABLE = consciously irrelevant."
    },
    "Evidence": {
      "type": "object",
      "description": "Provenance for a single fact value.",
      "properties": {
        "source_type": {
          "type": "string",
          "enum": ["TEXT", "IMAGE", "MULTI_SOURCE"],
          "description": "Origin modality of the evidence."
        },
        "source_ref": {
          "type": "string",
          "description": "Text span label, image index, or attachment identifier."
        },
        "evidence_note": {
          "type": "string",
          "description": "Brief human-readable observation that supports this fact."
        }
      },
      "required": ["source_type", "source_ref", "evidence_note"],
      "additionalProperties": false
    },
    "TextFact": {
      "type": "object",
      "description": "A textual fact with certainty and optional evidence.",
      "properties": {
        "value": {
          "type": "string",
          "description": "Extracted value or empty string when UNKNOWN."
        },
        "fact_state": {
          "$ref": "#/$defs/FactState"
        },
        "evidence": {
          "$ref": "#/$defs/Evidence"
        }
      },
      "required": ["value", "fact_state"],
      "additionalProperties": false
    },
    "IntegerFact": {
      "type": "object",
      "description": "An integer fact with certainty and optional evidence.",
      "properties": {
        "value": {
          "type": "integer",
          "minimum": 0,
          "description": "Extracted integer value; 0 is the sentinel for UNKNOWN, CONFLICT, or NOT_APPLICABLE."
        },
        "fact_state": {
          "$ref": "#/$defs/FactState"
        },
        "evidence": {
          "$ref": "#/$defs/Evidence"
        }
      },
      "required": ["value", "fact_state"],
      "additionalProperties": false
    },
    "LayoutShapeFact": {
      "type": "object",
      "description": "A user-described kitchen run shape with certainty and provenance.",
      "properties": {
        "value": {
          "type": "string",
          "enum": ["straight", "L-shaped", "U-shaped", "galley", "unknown"]
        },
        "fact_state": {"$ref": "#/$defs/FactState"},
        "evidence": {"$ref": "#/$defs/Evidence"}
      },
      "required": ["value", "fact_state"],
      "additionalProperties": false
    },
    "ZoneFact": {
      "type": "object",
      "description": "A user-described kitchen zone with certainty and provenance.",
      "properties": {
        "value": {
          "type": "string",
          "enum": ["base", "wall", "tall", "unknown"]
        },
        "fact_state": {"$ref": "#/$defs/FactState"},
        "evidence": {"$ref": "#/$defs/Evidence"}
      },
      "required": ["value", "fact_state"],
      "additionalProperties": false
    },
    "ModuleClassFact": {
      "type": "object",
      "description": "A user-requested module class with certainty and provenance.",
      "properties": {
        "value": {
          "type": "string",
          "enum": ["base", "wall", "tall", "unknown"]
        },
        "fact_state": {"$ref": "#/$defs/FactState"},
        "evidence": {"$ref": "#/$defs/Evidence"}
      },
      "required": ["value", "fact_state"],
      "additionalProperties": false
    },
    "LayoutEntityTypeFact": {
      "type": "object",
      "description": "Canonical Stage 3 layout entity classification with certainty and provenance.",
      "properties": {
        "value": {
          "type": "string",
          "enum": ["MODULE", "APPLIANCE_SLOT", "unknown"]
        },
        "fact_state": {"$ref": "#/$defs/FactState"},
        "evidence": {"$ref": "#/$defs/Evidence"}
      },
      "required": ["value", "fact_state"],
      "additionalProperties": false
    },
    "RoleCodeFact": {
      "type": "object",
      "description": "Canonical role code accepted by the deterministic Stage 8 adapter.",
      "properties": {
        "value": {
          "type": "string",
          "enum": [
            "generic_storage",
            "drawer",
            "sink",
            "dishwasher_slot",
            "oven",
            "hob",
            "narrow_cargo",
            "dish_dryer",
            "hood",
            "pantry",
            "fridge",
            "unknown"
          ]
        },
        "fact_state": {"$ref": "#/$defs/FactState"},
        "evidence": {"$ref": "#/$defs/Evidence"}
      },
      "required": ["value", "fact_state"],
      "additionalProperties": false
    },
    "RequiredLayoutEntity": {
      "type": "object",
      "description": "A single required furniture module or appliance slot supported by the linear layout contract.",
      "properties": {
        "name": {
          "$ref": "#/$defs/TextFact",
          "description": "Human-readable module or appliance-slot name."
        },
        "entity_type": {
          "$ref": "#/$defs/LayoutEntityTypeFact",
          "description": "Canonical machine entity type; never a translated free-text label."
        },
        "role_code": {
          "$ref": "#/$defs/RoleCodeFact",
          "description": "Canonical machine role code; unknown classification uses the unknown sentinel."
        },
        "module_class": {
          "$ref": "#/$defs/ModuleClassFact",
          "description": "User-requested class of module (base, wall, tall) or unknown."
        },
        "width_mm": {
          "$ref": "#/$defs/IntegerFact",
          "description": "Module width in millimetres."
        },
        "quantity": {
          "$ref": "#/$defs/IntegerFact",
          "description": "Number of units required."
        }
      },
      "required": ["name", "entity_type", "role_code", "module_class", "width_mm", "quantity"],
      "additionalProperties": false
    },
    "MissingQuestion": {
      "type": "object",
      "description": "A question about missing data that the deterministic flow or UX should surface.",
      "properties": {
        "question_id": {
          "type": "string",
          "description": "Stable machine-readable question identifier."
        },
        "field_path": {
          "type": "string",
          "description": "Dot-notation path to the relevant schema field."
        },
        "question": {
          "type": "string",
          "description": "Human-readable question text."
        },
        "priority": {
          "type": "string",
          "enum": ["BLOCKING", "IMPORTANT", "OPTIONAL"],
          "description": "BLOCKING = deterministic flow cannot proceed without this; IMPORTANT = strongly recommended; OPTIONAL = nice-to-have."
        },
        "reason": {
          "type": "string",
          "description": "Why this information is needed."
        }
      },
      "required": ["question_id", "field_path", "question", "priority", "reason"],
      "additionalProperties": false
    },
    "EvidenceItem": {
      "type": "object",
      "description": "A single source evidence entry summarising observed input.",
      "properties": {
        "source_type": {
          "type": "string",
          "enum": ["TEXT", "IMAGE", "MULTI_SOURCE"]
        },
        "source_ref": {
          "type": "string",
          "description": "Text span label, image index, or attachment identifier."
        },
        "observation": {
          "type": "string",
          "description": "Brief description of what was observed in this source."
        },
        "relevant_fields": {
          "type": "array",
          "description": "Schema field paths informed by this evidence.",
          "items": {
            "type": "string"
          }
        }
      },
      "required": ["source_type", "observation"],
      "additionalProperties": false
    },
    "ParserMetadata": {
      "type": "object",
      "description": "Technical metadata about the parser invocation.",
      "properties": {
        "request_id": {
          "type": "string",
          "description": "Caller-supplied or generated request identifier."
        },
        "parser_schema_version": {
          "type": "string",
          "description": "Version of the schema used for this parse."
        },
        "prompt_version": {
          "type": "string",
          "description": "Version of the parser prompt used."
        },
        "provider": {
          "type": "string",
          "enum": ["openrouter"],
          "description": "LLM provider."
        },
        "model_requested": {
          "type": "string",
          "description": "Model slug requested from the provider."
        },
        "model_returned": {
          "type": "string",
          "description": "Model slug actually returned, if the API reports it."
        },
        "parsed_at": {
          "type": "string",
          "format": "date-time",
          "description": "ISO 8601 timestamp of the parse."
        },
        "input_modalities": {
          "type": "array",
          "description": "Modalities present in the input.",
          "items": {
            "type": "string",
            "enum": ["text", "image"]
          }
        },
        "provider_request_id": {
          "type": "string",
          "description": "Provider-side request/generation ID if available."
        },
        "usage": {
          "type": "object",
          "description": "Token usage reported by the provider.",
          "properties": {
            "prompt_tokens": {
              "type": "integer"
            },
            "completion_tokens": {
              "type": "integer"
            },
            "total_tokens": {
              "type": "integer"
            }
          },
          "additionalProperties": false
        }
      },
      "required": [
        "request_id",
        "parser_schema_version",
        "prompt_version",
        "provider",
        "model_requested",
        "parsed_at",
        "input_modalities"
      ],
      "additionalProperties": false
    }
  }
}
